{"computation":"Count records whose record_type is telemetry_sample after all records pass the normalized-record/v1 validator.","definition":"Count of normalized telemetry_sample records in a declared synthetic mechanics fixture.","directionality":"descriptive_only","limitations":["This metric only demonstrates deterministic plumbing and has no racing-performance interpretation."],"metric_id":"demo-record-count","name":"Synthetic normalized record count","output_provenance":"derived","required_inputs":["timestamp"],"schema_version":"apex-labs.metric-definition/v1","unit":"count","version":"1.0.0"}
